name,location,description,price,image_url
Wisoky Upton and Kreiger Hotel,Terrymouth,Officiis acies voluptatum.,153093,https://source.unsplash.com/random/800x600?hotel&sig=8914605348749312
Farrell - Pollich Hotel,San Juan,Terga thesis quia decens crinis.,264348,https://source.unsplash.com/random/800x600?hotel&sig=8672792132190208
Weimann and Sons Hotel,Cleoberg,Omnis truculenter succedo sordeo pax arca soluta.,114543,https://source.unsplash.com/random/800x600?hotel&sig=6673675988238336
Sawayn Mohr and Wunsch Hotel,Schimmelland,Vorax paens delicate solus ager verto benigne tergiversatio officiis nostrum.,120704,https://source.unsplash.com/random/800x600?hotel&sig=6743909742936064
Bernhard - Kuhic Hotel,East Haydenside,Canonicus acceptus vulnus.,253317,https://source.unsplash.com/random/800x600?hotel&sig=5079251571179520
Larkin LLC Hotel,Christiansentown,Tam conscendo ocer quia cupressus defaeco credo.,256835,https://source.unsplash.com/random/800x600?hotel&sig=3886947294511104
King - Kohler Hotel,Evangelineview,Tempora defungo bibo terra occaecati curvo.,102250,https://source.unsplash.com/random/800x600?hotel&sig=291522987687936
O'Reilly - Howell Hotel,Kesslerside,Suffragium culpa in at cervus adipisci amissio in.,127563,https://source.unsplash.com/random/800x600?hotel&sig=2686892294275072
Kuhic - Kling Hotel,New Sasha,Crur carbo debitis coruscus demitto dedecor supra reiciendis amaritudo amor.,178134,https://source.unsplash.com/random/800x600?hotel&sig=6638244424843264
Sporer Waters and Kertzmann Hotel,West Eric,Voveo cras amita comparo stillicidium uterque.,266469,https://source.unsplash.com/random/800x600?hotel&sig=670016238256128
Swift - Hickle Hotel,Angelicafield,Bis adamo territo aveho aperte sophismata id.,228185,https://source.unsplash.com/random/800x600?hotel&sig=8379377532272640
Graham - Lindgren Hotel,Dameonstead,Causa cruciamentum taceo inventore.,284924,https://source.unsplash.com/random/800x600?hotel&sig=6142419057770496
Boyer - Ondricka Hotel,Deltona,Minus voco desidero vitium tolero et.,181723,https://source.unsplash.com/random/800x600?hotel&sig=5095622145212416
Farrell - Gleichner Hotel,Reginaldport,Corrigo clarus vesco dedico suus bos vinculum coaegresco conscendo ipsa.,196036,https://source.unsplash.com/random/800x600?hotel&sig=8275073297285120
Deckow and Sons Hotel,Timothyborough,Laboriosam coepi cerno ter ademptio defluo.,172569,https://source.unsplash.com/random/800x600?hotel&sig=2907738665385984
Gislason Leannon and Hermiston Hotel,West Sacramento,Peccatus textor suasoria tabella possimus.,177310,https://source.unsplash.com/random/800x600?hotel&sig=3433748831928320
Abbott - Kub Hotel,Port Tyler,Circumvenio tempora cornu reprehenderit impedit ait.,159506,https://source.unsplash.com/random/800x600?hotel&sig=3539260351184896
Leannon Inc Hotel,Port Gregoria,Succedo amitto volva supellex appono artificiose solio tardus et.,174631,https://source.unsplash.com/random/800x600?hotel&sig=3409043544604672
Gulgowski - Dach Hotel,Port Corahaven,Vereor cattus depromo.,182676,https://source.unsplash.com/random/800x600?hotel&sig=4518674058706944
Moen Durgan and Blanda Hotel,Osbornebury,Volva pel nisi uredo ante vesica.,116865,https://source.unsplash.com/random/800x600?hotel&sig=429485201555456
Tillman - Hane Hotel,South Kayden,Tardus ratione amplus crinis timor laborum ex vereor thymum.,109756,https://source.unsplash.com/random/800x600?hotel&sig=4830602649927680
Hamill Inc Hotel,New Austin,Ipsum ars sodalitas eveniet amoveo cupiditas paulatim.,295986,https://source.unsplash.com/random/800x600?hotel&sig=3226247307984896
Auer Bode and Koelpin Hotel,Kiehnborough,Cultellus solvo vereor tum cumque paens.,73922,https://source.unsplash.com/random/800x600?hotel&sig=5908651850072064
Koepp - Bradtke Hotel,Blue Springs,Celer uredo decipio traho certe quo vinculum.,245863,https://source.unsplash.com/random/800x600?hotel&sig=8456348448587776
Ernser - Bradtke Hotel,Lemkeboro,Curto commodi cura distinctio.,115607,https://source.unsplash.com/random/800x600?hotel&sig=1283636357758976
Jakubowski - Kiehn Hotel,Jerrellview,Balbus crudelis velum admoveo tribuo et vorago omnis.,251811,https://source.unsplash.com/random/800x600?hotel&sig=206421891219456
Murray and Sons Hotel,South Jefffurt,Vulpes vulariter iusto.,210534,https://source.unsplash.com/random/800x600?hotel&sig=6641148793716736
Armstrong - Graham Hotel,Findlay,Timor eum cinis temperantia denique praesentium sequi.,245511,https://source.unsplash.com/random/800x600?hotel&sig=7799744820674560
Pfeffer - Lowe Hotel,Langoshton,Subiungo sollicito ullam ustulo vinculum caelestis adsidue ipsum audio tabella.,103428,https://source.unsplash.com/random/800x600?hotel&sig=7331547214512128
Kuhlman Bartoletti and Torphy Hotel,La Crosse,Uxor vitae ventus claudeo.,296128,https://source.unsplash.com/random/800x600?hotel&sig=2201494958899200
Prosacco - Smith Hotel,Fort Leopoldo,Correptius sumptus quam tepidus conitor armarium alioqui nesciunt.,205051,https://source.unsplash.com/random/800x600?hotel&sig=220594798854144
Nitzsche Thiel and O'Hara Hotel,Cedrickcester,Repellendus bos decipio trado vigor sophismata reiciendis crudelis tenus.,137783,https://source.unsplash.com/random/800x600?hotel&sig=5274138820214784
Casper Durgan and Mante Hotel,Iowa City,Antiquus usus aestivus tricesimus decet spargo.,159932,https://source.unsplash.com/random/800x600?hotel&sig=1271848216035328
Lebsack Group Hotel,Wilkinsonworth,Cena repellat utrimque denuncio tergiversatio ascisco demulceo tergiversatio claro.,159840,https://source.unsplash.com/random/800x600?hotel&sig=5966082672164864
Dickinson McLaughlin and Roob Hotel,North Miami Beach,Coepi adnuo thema.,131863,https://source.unsplash.com/random/800x600?hotel&sig=7861870182531072
O'Keefe O'Kon and Morar Hotel,South Devanteburgh,Abbas caput cornu sub attollo nulla depromo tabella vel suffragium.,120325,https://source.unsplash.com/random/800x600?hotel&sig=1283226924482560
Zulauf - Gibson Hotel,Russelcester,Avarus synagoga caritas sui adficio.,161080,https://source.unsplash.com/random/800x600?hotel&sig=444913621663744
Wilkinson and Sons Hotel,New Eudora,Atque cunabula vigilo repudiandae cunabula defendo commemoro temporibus.,133946,https://source.unsplash.com/random/800x600?hotel&sig=1731950228275200
Hahn Balistreri and Yundt Hotel,Frankchester,Desolo aggero creber ascisco pax commodi cuius arma crepusculum.,142814,https://source.unsplash.com/random/800x600?hotel&sig=1589061506564096
Dickinson - Emmerich Hotel,Fort Zanderburgh,Sopor approbo tripudio.,100209,https://source.unsplash.com/random/800x600?hotel&sig=432195315433472
Berge Inc Hotel,Amayachester,Tabula dignissimos cognomen demum pauci quasi confero quibusdam.,185967,https://source.unsplash.com/random/800x600?hotel&sig=2792610005516288
Nicolas - Skiles Hotel,Adamsside,Deorsum synagoga deduco blandior distinctio clamo surgo vesper absconditus.,138579,https://source.unsplash.com/random/800x600?hotel&sig=4551714271133696
Murazik Durgan and Blanda Hotel,Marksberg,Reiciendis aperte defleo tenax adflicto thesaurus tabgo statim.,204956,https://source.unsplash.com/random/800x600?hotel&sig=2458573453918208
Reinger - Turner Hotel,Caitlynport,Una artificiose avaritia voluptas ipsa aequus.,61421,https://source.unsplash.com/random/800x600?hotel&sig=8781169428529152
Schmitt Langosh and Dooley Hotel,Lake Esta,Utrimque amplus comptus approbo.,270571,https://source.unsplash.com/random/800x600?hotel&sig=8837034267377664
Goyette LLC Hotel,East Linnea,Considero assentator causa aequitas decumbo exercitationem.,295315,https://source.unsplash.com/random/800x600?hotel&sig=8343871310266368
Beahan Bruen and Rohan Hotel,East Mosesbury,Celebrer stillicidium tollo calculus ver neque comitatus.,238944,https://source.unsplash.com/random/800x600?hotel&sig=8799641900417024
Leuschke Inc Hotel,Doylestead,Summisse sonitus necessitatibus totus decretum acies vesper cattus debilito solitudo.,84730,https://source.unsplash.com/random/800x600?hotel&sig=3425533943611392
Predovic Group Hotel,South Janessaside,Celebrer sit officia campana ter denuncio veniam allatus spargo maiores.,158373,https://source.unsplash.com/random/800x600?hotel&sig=7883545211043840
Kirlin - Williamson Hotel,Lake Michael,Caput virgo minima animadverto fugiat.,113062,https://source.unsplash.com/random/800x600?hotel&sig=4434974700732416
Balistreri - O'Reilly Hotel,Port Bonitaton,Quo repellendus coniuratio abutor vel vix apud.,245029,https://source.unsplash.com/random/800x600?hotel&sig=136380407611392
Feeney - Hintz Hotel,New Abigale,Omnis tenuis tertius.,179851,https://source.unsplash.com/random/800x600?hotel&sig=8211994440105984
McDermott Sipes and Hills Hotel,Dangelofield,Beneficium spero delibero.,203324,https://source.unsplash.com/random/800x600?hotel&sig=6803931101396992
Casper Hamill and Hane Hotel,Coral Springs,Textus ventus curis tabella solitudo delicate excepturi ultra summa.,263443,https://source.unsplash.com/random/800x600?hotel&sig=2823000132943872
Wilkinson - Metz Hotel,Daviscester,Creber qui currus vulariter.,106932,https://source.unsplash.com/random/800x600?hotel&sig=1933975826202624
Runolfsdottir Kemmer and Ledner Hotel,New Magalihaven,Villa careo coadunatio tripudio appello tredecim ancilla.,282567,https://source.unsplash.com/random/800x600?hotel&sig=4489871005581312
Stokes - Monahan Hotel,Lednerland,Cuius uxor paulatim.,149733,https://source.unsplash.com/random/800x600?hotel&sig=3997602607529984
Hilll - Volkman Hotel,Salt Lake City,Depono aestus tam stultus utroque suscipit crapula agnosco terminatio.,219870,https://source.unsplash.com/random/800x600?hotel&sig=4163956929200128
Pollich and Sons Hotel,Alvinaport,Laudantium tametsi acervus vulgivagus pax uberrime nostrum concido comburo.,135887,https://source.unsplash.com/random/800x600?hotel&sig=1746899828736000
Hauck - O'Kon Hotel,Port Dinoboro,Ambulo odit cumque adsidue demonstro altus utrum.,188683,https://source.unsplash.com/random/800x600?hotel&sig=8165131951276032
Hintz and Sons Hotel,Middletown,Una sponte capto illum blandior tibi xiphias collum.,220943,https://source.unsplash.com/random/800x600?hotel&sig=3696951358914560
Kiehn Larson and Raynor Hotel,North Curtbury,Cubo rem canis theologus speculum dicta.,285194,https://source.unsplash.com/random/800x600?hotel&sig=7971856659251200
Lockman - Hagenes Hotel,West New York,Placeat barba solutio audentia.,216904,https://source.unsplash.com/random/800x600?hotel&sig=7277018360053760
White Inc Hotel,North Karleestead,Inflammatio dolores coadunatio vigilo damnatio defendo depulso qui.,290684,https://source.unsplash.com/random/800x600?hotel&sig=8900682096574464
Bergstrom Anderson and Olson Hotel,Fort Garrick,Supellex consectetur victus uterque vereor aptus tersus combibo sordeo tabgo.,34883,https://source.unsplash.com/random/800x600?hotel&sig=4765601417396224
Huel - Braun Hotel,Lake Opheliaborough,Incidunt comis conqueror corroboro adfectus sortitus vos voluptatibus.,209879,https://source.unsplash.com/random/800x600?hotel&sig=6446261334966272
Gerhold - Stanton Hotel,Ortiztown,Clibanus articulus vereor sursum.,168287,https://source.unsplash.com/random/800x600?hotel&sig=7857314425995264
Ortiz Group Hotel,Caguas,Pariatur contego altus soleo caelestis.,200814,https://source.unsplash.com/random/800x600?hotel&sig=2998878768988160
Anderson - Tillman Hotel,Fort Stephonmouth,Arguo tribuo creptio.,182201,https://source.unsplash.com/random/800x600?hotel&sig=1910731412865024
Ortiz - Hilll Hotel,Sanfordworth,Varius clam id abstergo.,223606,https://source.unsplash.com/random/800x600?hotel&sig=2803938151628800
Rau LLC Hotel,Bartonboro,Barba molestiae verus.,54317,https://source.unsplash.com/random/800x600?hotel&sig=1368409828753408
Flatley - Armstrong Hotel,Lilyside,Utrimque suggero itaque.,163209,https://source.unsplash.com/random/800x600?hotel&sig=6963197240147968
Donnelly Considine and Dach Hotel,Julienview,Cohibeo timor texo campana.,96630,https://source.unsplash.com/random/800x600?hotel&sig=7221086766759936
Leuschke LLC Hotel,Port Kenyatta,Agnitio thema molestias iusto ager aut tolero calco.,237933,https://source.unsplash.com/random/800x600?hotel&sig=6749909266989056
Bernier and Sons Hotel,North Albina,Facilis volo amplexus tardus cariosus abutor aegrus velut.,87889,https://source.unsplash.com/random/800x600?hotel&sig=5001332779909120
Lang Bosco and Wunsch Hotel,Colton,Cum umquam provident sophismata solus eveniet reiciendis.,35608,https://source.unsplash.com/random/800x600?hotel&sig=4224388939382784
Purdy Wisoky and Kirlin Hotel,Cruickshankfurt,Depulso clam confido usus tantum curiositas tero coniuratio.,220256,https://source.unsplash.com/random/800x600?hotel&sig=4825873190486016
Okuneva Group Hotel,Katelynnside,Artificiose degusto occaecati audacia depereo vehemens cupiditas acsi.,62480,https://source.unsplash.com/random/800x600?hotel&sig=4587180385107968
Turner Fadel and Erdman Hotel,Maidaport,Advoco derideo commemoro vergo.,54249,https://source.unsplash.com/random/800x600?hotel&sig=1035875416801280
Stracke - Huels Hotel,East Jameybury,Absens baiulus cinis aptus.,150810,https://source.unsplash.com/random/800x600?hotel&sig=5186805741649920
Parker Group Hotel,North Justice,Sordeo vorax cunctatio cras aeger congregatio vomer repudiandae sollicito.,252101,https://source.unsplash.com/random/800x600?hotel&sig=8900961758085120
Quigley Group Hotel,Mannland,Teres tero nesciunt celer odio ad depereo.,74809,https://source.unsplash.com/random/800x600?hotel&sig=4526995006291968
Johnson Rutherford and Legros Hotel,Nicolasport,Uterque cuppedia curatio desolo vir necessitatibus tutis.,245529,https://source.unsplash.com/random/800x600?hotel&sig=7458854063308800
Gulgowski Mitchell and Auer Hotel,South Judyfurt,Vulpes via vulgo tabgo.,163121,https://source.unsplash.com/random/800x600?hotel&sig=7087884095979520
Littel and Sons Hotel,Centreville,Complectus peccatus eius.,170313,https://source.unsplash.com/random/800x600?hotel&sig=2202775997906944
Schumm Inc Hotel,South Williamburgh,Vel natus turbo.,142912,https://source.unsplash.com/random/800x600?hotel&sig=4015352564416512
Gulgowski Ward and Willms Hotel,East Marian,Dolorum venio validus solutio spiritus hic volutabrum.,277972,https://source.unsplash.com/random/800x600?hotel&sig=6873856211943424
Lowe Group Hotel,New Samara,Itaque utrimque comis censura creptio torrens paulatim convoco sursum auditor.,57403,https://source.unsplash.com/random/800x600?hotel&sig=8777050284359680
Runolfsdottir - Littel Hotel,East Kirk,Ceno censura timidus audeo blandior pecto cattus.,71359,https://source.unsplash.com/random/800x600?hotel&sig=1193911116627968
Wiegand - Russel Hotel,East Lambertshire,Adinventitias viscus artificiose temporibus vito.,81443,https://source.unsplash.com/random/800x600?hotel&sig=2771277118963712
Rath and Sons Hotel,New Augustcester,Crastinus beatus capto pectus voluptatibus necessitatibus demoror dolore.,142014,https://source.unsplash.com/random/800x600?hotel&sig=587218458509312
Homenick - Ortiz Hotel,North Santiagoberg,Cicuta utilis volo contego aedificium cur credo.,87143,https://source.unsplash.com/random/800x600?hotel&sig=1128659515604992
Johnson Inc Hotel,Angelinechester,Acies dolorum ter confero fuga amissio conor decerno versus.,72816,https://source.unsplash.com/random/800x600?hotel&sig=5924869403312128
Sawayn Zieme and McGlynn Hotel,Ressiemouth,Ambulo sonitus vulariter barba viscus attero ad vulnero.,87323,https://source.unsplash.com/random/800x600?hotel&sig=2049473547075584
Kunde Bruen and Satterfield Hotel,West Hymanburgh,Teneo velut strues sollers arceo undique tepidus ustilo ancilla.,162732,https://source.unsplash.com/random/800x600?hotel&sig=6477371832008704
Hettinger Group Hotel,Port Zanderville,Astrum terror vivo audio mollitia apud.,110017,https://source.unsplash.com/random/800x600?hotel&sig=7297308089647104
Reichert LLC Hotel,Dayton,Adipiscor vergo verbum supra stabilis.,112219,https://source.unsplash.com/random/800x600?hotel&sig=6406700114378752
Altenwerth Inc Hotel,Hectorfort,Aptus abbas bonus admoveo spiritus vitium sortitus uterque.,161966,https://source.unsplash.com/random/800x600?hotel&sig=7153475932651520
Thiel - Wintheiser Hotel,Fort Abelardoshire,Utor adulatio tutis certe.,191117,https://source.unsplash.com/random/800x600?hotel&sig=3546034603032576
Braun Fritsch and Becker Hotel,Corkerymouth,Enim audentia curso utrimque sono animi.,93335,https://source.unsplash.com/random/800x600?hotel&sig=8104670346084352